sentence,highlight,category,subcategory,polarity
The most talked about issues concerning road are probably congestion and safety.,The most talked about issues are congestion and safety.,APPRECIATION,REACTION,NEG
"Congestion is most apparant around the major conurbations such as London, Greater Manchester and Birmingham.",NONE,NONE,NONE,NONE
The simple way to solve this problem would be to either build more roads or make the present ones larger.,NONE,NONE,NONE,NONE
"However this, as seen in recent events for example Newbury, has been met with strong opposition from environmental groups and local residents.",NONE,NONE,NONE,NONE
"another way to reduce congestion, especially in the large cities, could be to persuede people not to use their vehicles at all.",NONE,NONE,NONE,NONE
Introducing schemes such as the 'park-and-ride' scheme and encouraging people to use bicycles would certainly reduce the number of cars on the road.,NONE,NONE,NONE,NONE
Safety is often talked about as a priority factor concerning roads.,a priority factor,APPRECIATION,WORTH,NONE
Too many accidents occur because of dangerous driving on busy roads.,Too many accidents,APPRECIATION,REACTION,NEG
There are several ways to combat this problem.,NONE,NONE,NONE,NONE
Although the legal limit for drinking while driving has just been increased lowering the limit by several units would detere many people from using their own vehicles and instead encourage them to use public transport.,NONE,NONE,NONE,NONE
"Increasing the amount of law enforcement could also be effective, giving the police more right to make arrests and increasing the number of speed cameras as well as possibly give larger fines.",could also be effective,APPRECIATION,WORTH,POS
Cutting down on national speed limit may also encourage drivers to take more care.,may also encourage,APPRECIATION,WORTH,POS
The condition of roads is often a local issue rather then of national concern.,NONE,NONE,NONE,NONE
"It is therefore up to the local council to maintain their roads better, especially in winter.",NONE,NONE,NONE,NONE
This may require the local council obtaining more money from the government.,NONE,NONE,NONE,NONE
Safety is much less of a factor for rail transport.,much less of a factor,APPRECIATION,WORTH,NONE
Here the major talking point is efficiency.,major talking point,APPRECIATION,WORTH,NONE
It is often noted that trains are delayed and are rarely running on time.,delayed and are rarely running on time,APPRECIATION,REACTION,NEG
"Because of this inefficiency many of rails customers are turning to other forms of transport, cars mostly but for long distance journeys flying is an increasingly attractive option.",increasingly attractive,APPRECIATION,REACTION,POS
A large amount of blame for this inefficiency goes to the actual trains which are in most cases out of date and slower then modern ones such as the French TGV or the Japanese 'bullet' train.,A large amount of blame,APPRECIATION,WORTH,NEG
"The train tracks can also be blamed, as they are often in a state of repair and this inevitably delays trains.",train tracks can also be blamed,APPRECIATION,WORTH,NEG
It is hoped that the recent privatisation of British Rail will bring in more up to date trains and increase the overal efficiency of travelling by train is a bid to attract much more customers.,NONE,NONE,NONE,NONE
"As time progresses, road and rail travel will play an increasingly large part in future travel and transport.",increasingly large part,APPRECIATION,WORTH,NONE
"Roads have been increasing in both size and number, with the recent introduction of the ""super-motorway""; a five or six lane development planned to connect Birmingham with the M25.",NONE,NONE,NONE,NONE
Space for such projects is greatly limited due to green-belt restrictions and local opposition.,greatly limited,APPRECIATION,COMPOSITION,NEG
Such a scheme would produce vast quantities of pollution and noise.,pollution and noise,APPRECIATION,REACTION,NEG
"there is no clear-cut way to overcome these problems, eve though literally millions of pounds has been invested by companies such as Tarmat.",no clear-cut way,APPRECIATION,REACTION,NEG
"On many roads, Sound Baffles have been erected to combat noise by absorbing the carrier waves.",NONE,NONE,NONE,NONE
"these, however, have only a limited affect.",only a limited affect,APPRECIATION,WORTH,NEG
"A way around these problems is, however, in sight.",in sight,APPRECIATION,REACTION,POS
"Road transport will be greatly improved if it is the cars themselves which become quieter, more efficient, and less harmful to the general environment.",NONE,NONE,NONE,NONE
"Many cars have come onto the market which claim to be all these things and more, but they never seem to take off.",never seem to take off,JUDGEMENT,CAPACITY,NEG
The perfect solution would be electric vehicles which would overcome all the aforementioned hurdles.,The perfect solution would be,APPRECIATION,WORTH,POS
The only problem is their range and speed.,The only problem,APPRECIATION,REACTION,NEG
"They can only go about fifty miles per hour as a maximum, and require recharging every 100 miles; which in itself can take nearly six hours!",They can only go about fifty miles per hour,APPRECIATION,REACTION,NEG
"Developments are taking place for faster and more efficient electric cars, but before they can be seen on British roads, we will have to wait well into the next century.",have to wait well into the next century,APPRECIATION,REACTION,NEG
"Railways have developed too, recently.",NONE,NONE,NONE,NONE
All the problems facing railways at the moment are financial and not geographic.,NONE,NONE,NONE,NONE
There is not the widespread interest in rail travel which there once was.,not the widespread interest,APPRECIATION,WORTH,NEG
"More and more people are opting to travel by car these days, and so there is not as much economical input.",NONE,NONE,NONE,NONE
"Closure of lines due to under-usage is now quite common, the costs of maintenance and running costs exceed the income from users.",Closure of lines due to under-usage is now quite common,APPRECIATION,REACTION,NEG
"There is a way around these problems, but it is very expensive.",very expensive,APPRECIATION,REACTION,NEG
A huge advertising campaign explaining how much cheaper rail travel is when compared to other modes of transport would eventually get through.,would eventually get through,APPRECIATION,WORTH,POS
"New trains are also in development, and once again they run off electricity.",NONE,NONE,NONE,NONE
"Along with this, though, is a certain controversy about electrifying the railway lines.",controversy,APPRECIATION,REACTION,NEG
"All in all, the road and rail travel will have a problematic voyage into the future, but their problems will be overcome in the end.", problematic voyage  but their problems will be overcome in the end,APPRECIATION,REACTION,POS
On Britains roads there is an ever increasing volume of traffic.,ever increasing volume of traffic,APPRECIATION,REACTION,NEG
The road network is no longer able to carry this traffic without hold-ups and traffic jams..,no longer able,JUDGEMENT,CAPACITY,NEG
"To remedy this the government has started adding a fourth lane on some streches of our motorways and constructing ring roads and bypasses, with mixed reception.",with mixed reception,APPRECIATION,REACTION,NEG
While the road system is being improoved there seems to be an endless series of roadworks which restrict the highways and cause further delay while the roadworks are in place.,restrict and delay,APPRECIATION,REACTION,NEG
The inability to cope with the ammount of traffic by the road system obviously increases the risk of drives having an accident and the drivers have to be constantly alert as they are nearly always in capacity traffic.,increases the risk,APPRECIATION,WORTH,NEG
It might seem an easy soloution to this  mayhem would be to use public transport; i.e. the Railways.,mayhem,APPRECIATION,REACTION,NEG
People are not taking to the Rail system because of its lack of integration due to the recent privitisation of different areas.,NONE,NONE,NONE,NONE
It has been shown that different companies charge different fares for exactly the same route!, different companies charge different fares for exactly the same route,JUDGEMENT,PROPRIETY,NEG
The main disadvantage with the railways is as the rail service and the bus service are normally owned by different companies it is probable that it is not possible to walk onto a bus off the train.,The main disadvantage,APPRECIATION,REACTION,NEG
If the services were integrated there would be a bus time table which coincided with the train arrival times.,NONE,NONE,NONE,NONE
"Then people would be more likely to catch the train as they would not have to look forwards to a long walk, wait for a bos or an expensive taxi ride.",NONE,NONE,NONE,NONE
"My soloution to the problem would be to improve the rail system and its related bus services, this would get people of the roads and onto the trains.",NONE,NONE,NONE,NONE
To improove the rail service trains have got to be timed to arrive and depart at key times i.e. arrive at eight o'clock and leave at half past six.,NONE,NONE,NONE,NONE
The train and bus companies have to liase with each other and the train fares have to remain relatively cheap i.e. the same price or less as it would cost to go by car.,NONE,NONE,NONE,NONE
If the rate of car ownership continues to increase at such a rapid rate then the roads will be completely congested.,will be completely congested,APPRECIATION,REACTION,NEG
This is the main problem facing the UK's transport system.,the main problem,APPRECIATION,WORTH,NEG
The reasons for this are many and varied.,NONE,NONE,NONE,NONE
"People of today want more freedom and have more disposable income, both factors which will lead to an increase in car ownership.",People of today want more freedom and have more disposable income,JUDGEMENT,PROPRIETY,NONE
"These views are supported by cases like the James Bulger case, and the Fred and Mary West case which have very high publicity and give increasing public awareness to the people on the streets today.",NONE,NONE,NONE,NONE
"People also use cars because they are more convenient than public transport as they can travel whenever they wish, and can travel ""door-to-door"" instead of having to walk to bus stops and stations.",more convenient,APPRECIATION,REACTION,POS
"The enourmos levels of vehicles on the roads have meant that using a bicycle to travel has become unacceptable to many people, due to the danger and also to the levels of pollution from cars on the streets.",unacceptable / the danger and also to the levels of pollution,APPRECIATION,REACTION,NEG
"Rail travel has seen decreased popularity in recent years, due to the immense popularity of the car now.",has seen decreased popularity,APPRECIATION,WORTH,NEG
Some people may not use trains due to their seemingly unreliable services.,unreliable,JUDGEMENT,CAPACITY,NEG
"Trains also fail to offer the freedom of choice available with cars, as the passengers are tyed to the timetables and locations of railway stations.",fail to offer,JUDGEMENT,CAPACITY,NEG
"I think that the government should help Britains transport by aiming to decrease the amount of car useage and increase the usage of buses, trains and other forms of public transport.",NONE,NONE,NONE,NONE
"The government should do this by investing more money into public transport than into road improvements, such as the widening of motorways.",NONE,NONE,NONE,NONE
"This increased investment would lead to more attractive public transport, with more services on the timetables, lower rates and less delays.",more attractive public transport,APPRECIATION,REACTION,POS
These factors may make people convert from using their car to travel to work or school and to use busses or trains instead.,may make people convert,APPRECIATION,WORTH,POS
"This would lead to less congested roads, which could then be used efficiently by people with not other option, and a less polluted environment for all of us to live in.",less congested roads,APPRECIATION,REACTION,POS
This is because public transport is less polluting than personal car useage., less polluting,APPRECIATION,REACTION,POS
Travelling by motorway today is not as easy as it was ment to be by any standards yet every morning and evening motorways accross the United Kingdom are blocked solid with traffic to and from work.,is not as easy as it was ment to be,APPRECIATION,REACTION,NEG
"Not only is this 'ecologically' unsound, due to the harmfull byproducts of the combustion engine which has been stressed in the press recently, but it is also stressful, time wasting and expensive.","ecologically' unsound / stressful, time wasting and expensive",APPRECIATION,REACTION,NEG
"Earth has a finite supply of the fossil fuels from which petroleum and disel for our cars & trains to run on, but 'we' have a need to get to work which could be anything up to 200 miles away.",NONE,NONE,NONE,NONE
Not only is there problems in traveling from A to B but the likelyhood is that if B is any major city you will waste more time looking for somewhere to park there.,will waste,APPRECIATION,REACTION,NEG
"During pre-war Britain rail was the only means of long distance travel within the UK and so the rail system was more efficient with more frequent trains and many more stations, but as the motor car became more popular less people used the rail road and the system declined, the smaller demand has led to less frequent services at an increased price.","declined, the smaller demand has led to less frequent services at an increased price",APPRECIATION,REACTION,NEG
In my opinion the only way forward is the increased use of public transport systems because of the sheer waste caused by the adverage two-car family.,sheer waste,APPRECIATION,REACTION,NEG
"The majority of the cars that you will see whilst travelling at a 'snails' pace a long the M6 out side Birmingham will be driven by one person with no passengers, ",snails' pace ,APPRECIATION,REACTION,NEG
if these drivers had offered to give a collegue from work a lift home the numbers on the road would effectivly be halved.,if these drivers had offered to give a collegue from work a lift home the numbers on the road would effectivly be halved.,JUDGEMENT,PROPRIETY,NEG
Cities such as Manchester have tried hard to controll the incrasing numbers of cars by introducing by-passes & providing multi-storey car parking.,have tried hard,JUDGEMENT,CAPACITY,POS
Some cities have even banned cars from entering the city during work hours making pedestrian life enjoyable.,Some cities have even banned cars,JUDGEMENT,TENACITY,POS
Trams have been restablished in some cities allowing people to leave their car to do their shopping.,NONE,NONE,NONE,NONE
This in my opinion is the attitude that should be adopted not only by town & city councills but by the government to reduce the number of cars on the road.,the attitude that should be adopted,APPRECIATION,WORTH,POS
Amongst recent issues there has been big problems in by the amount of heavy goods vehicles on British roads today.,big problems,APPRECIATION,WORTH,NEG
"This amount of traffic on the roads causes mass congestion on motorways such as the M25 in London and the M61 into Manchester,",causes mass congestion,APPRECIATION,WORTH,NEG
this static movement on British motorways has caused an increase in gas emissions from car exhausts into the atmosphere which will eventually cause global warming.,will eventually cause global warming,APPRECIATION,WORTH,NEG
A few suggestions have been made to remedy these problems but with no great effect.,with no great effect,APPRECIATION,REACTION,NEG
A number of these are listed below.,NONE,NONE,NONE,NONE
An allowance of better access into Britain main industrial centres buy the building of large and susstacial highways.,NONE,NONE,NONE,NONE
"A limited number of H.G.V. operators, only submitting a few lorries off their fleet to be used on British roads.",NONE,NONE,NONE,NONE
A kind of cataylitic converter for diesel engines to reduce some of the harmful emissions.,NONE,NONE,NONE,NONE
Another idea is for the government to introduce some type of tolling system to be used on motorway and main A roads.,NONE,NONE,NONE,NONE
A final approach to the problem of congestion on motorways is to make Heavy Goods transport compulsory for rail only.,NONE,NONE,NONE,NONE
"Here are only a few suggestions of how too convert British roads, but just these few would be cause for debate.",cause for debate,APPRECIATION,REACTION,NEG
The problems of these suggestions is that it would cost millions of pounds to put any one of them into practice.,would cost millions of pounds,APPRECIATION,REACTION,NEG
Take the first suggestion for example a network of routes into all major industrial cities would cost billions due to the fact that it costs £1million a mile of motorway.,NONE,NONE,NONE,NONE
If there were only a limited number of H.G.V. operators it would drive alot of people out of business and that wouldn't be in the best interest of the government.,NONE,NONE,NONE,NONE
A cataylitic converter for diesel engines is a good idea but it would only reduce gas emissions and not congestions.,is a good idea but it would only reduce gas emissions and not congestions,APPRECIATION,REACTION,NEG
All the suggestions I have made have problems and this is why we still have problems on our roads today.,have problems,APPRECIATION,REACTION,NEG
The modern traffic jam is now a familiar situation to nearly all of the western worlds population.,traffic jam is now a familiar situation,APPRECIATION,REACTION,NEG
If every time we use our cars to travel any distance we find ourselfs in a 10 mile tail-back why do we still insist that that we travel in such a meander., why do we still insist that that we travel in such a meander,JUDGEMENT,TENACITY,NEG
"To illistrate my point, if every time you took a train, it stops for 2 hours on the track, everyone would stop taking it.",NONE,NONE,NONE,NONE
So why do we still insist on travelling on the road.,So why do we still insist on travelling on the road.,JUDGEMENT,TENACITY,NEG
"The answer most likly lies in 2 areas, firsty the attitude of many westerners is that ""it is their right to travel in such a mannor'.","the attitude of many westerners is that ""it is their right to travel in such a mannor'",JUDGEMENT,PROPRIETY,NEG
"This is in my opinion, shows considerable ignorance.",considerable ignorance,JUDGEMENT,PROPRIETY,NEG
"I am by far and away no 'greeny' who wants to make everyone live in tipee's and eat soya bean soup, however I do agree that somthing should be done about the volume of traffic that is on our roads today.",no 'greeny' who wants to make everyone live in tipee's and eat soya bean soup,JUDGEMENT,PROPRIETY,NEG
"The governments answer to the considerably growing amount of traffic on our roads it just to back move, they are not even attempting to treat the cause, thent more and more people are now driving.",they are not even attempting to treat,JUDGEMENT,TENACITY,NEG
We all feel that we have a divine right to be on the road.,We all feel that we have a divine right to be on the road.,JUDGEMENT,PROPRIETY,NEG
"Do we, the westeren world (5% of the population of the world), have the right to use the resources of the rest of the world at the environmental cost?",use the resources of the rest of the world at the environmental cost,JUDGEMENT,PROPRIETY,NEG
Just beause we can not be bothered to get out of bed a bit early to catch public transport.,Just beause we can not be bothered to get out of bed a bit early,JUDGEMENT,TENACITY,NEG
That could have disasterous implications.,disasterous implications,APPRECIATION,WORTH,NEG
"The 2nd reason, is the promblem that the public transport service, for example rail, is declining so much, there is no train to catch in the morning.",declining so much,APPRECIATION,COMPOSITION,NEG
"People stopped using trains because of the fall in standards,",the fall in standards,APPRECIATION,REACTION,NEG
"these people were forced onto the road, routes became unprofitable and so were closed and services cut back, forcing more people onto the roads.",forcing more people onto the roads,APPRECIATION,REACTION,NEG
The whole system has now formed a spiraling circle of road use.,spiraling circle of road use,APPRECIATION,REACTION,NEG
"This has now been intensifyed with the sale of the railways, to privite rail companys, profit motivated.",intensifyed,APPRECIATION,REACTION,NEG
"The vital, small rail links may now be closed, priviously they where subsudised to make up the loss, now the privite companies can not afford to do this so many will close, cutting off small towns and villages.",cutting off small towns and villages,APPRECIATION,REACTION,NEG
"The only way to stop the circle will be to break it, the only people to do this is the government or ourselves,",NONE,NONE,NONE,NONE
 If we make the effort to use public transport it will expand into a good service;,NONE,NONE,NONE,NONE
Unfortunatly the public seam to be appethetic to this idea.,appethetic,JUDGEMENT,PROPRIETY,NEG
"As the technological advances made in science become greater producing quicker, more powerful products of the time it is nessecary that the ability to run such projects also develops as fast.",NONE,NONE,NONE,NONE
This is where the computer is used.,NONE,NONE,NONE,NONE
Computers are able to run much faster than the human brain and without doubt they are able to hold much more information on a vast range of topics.,are able to run much faster than the human brain,APPRECIATION,REACTION,POS
Humans grow ever more dependant on computers as the technology continues to advance.,ever more dependant,JUDGEMENT,CAPACITY,NEG
The ability the computer has to process information and present it in a fashion in which we can understand it is amazing.,amazing,APPRECIATION,REACTION,POS
It is such speed which gives the computer processor the edge over the human brain.,the edge over the human brain,APPRECIATION,REACTION,POS
There are however tasks which the computer cannot acomplish.,cannot acomplish,JUDGEMENT,CAPACITY,NEG
A computer is not free thinking like a human and can therefore only accomplish what it is programmed to do., is not free thinking,JUDGEMENT,CAPACITY,NEG
"This could cause a great problem, for example the smallest of errors in the program would cause the computer to proceed with the wrong program as it cannot distinguish that the program has an error.",could cause a great problem,APPRECIATION,WORTH,NEG
It reads the program as a human would instructions and processes them.,NONE,NONE,NONE,NONE
If a human would have been in the same position the error would have more chance of being detected and the product would have a better change of being satisfactory.,NONE,NONE,NONE,NONE
Although in this situation the human would take longer to process the order there would be a greater chance of the correct finished product that the attempt by the computer.,there would be a greater chance of the correct finished product,APPRECIATION,WORTH,POS
However if the correct program is loaded into the computer it is a much more efficient method of production.,a much more efficient method,APPRECIATION,REACTION,POS
This is well illustrated in the car manufacturing industry of today.,NONE,NONE,NONE,NONE
The production line would consist of robots all doing the job of a human but with advantages to the producer.,NONE,NONE,NONE,NONE
However one key factor is that in order for the computer to work it needs a human brain.,NONE,NONE,NONE,NONE
This again is because of the computer's inability to think.,inability to think,JUDGEMENT,CAPACITY,NEG
They only do what they are told and a human is needed to input such information.,They only do what they are told,JUDGEMENT,CAPACITY,NEG
A good example of this is at the Rolls Royce factory.,NONE,NONE,NONE,NONE
Although all the engine parts are made by computer controlled robots a human had to input the original template of the piece.,NONE,NONE,NONE,NONE
The man also has to be present during the manufacturing process of the piece incase anything goes wrong so that he can correct the program.,NONE,NONE,NONE,NONE
This shows that without the input and knowledge of a human brain the computer is a virtually worthless machine.,virtually worthless,APPRECIATION,WORTH,NEG
All of the vast amount of knowledge and information stored in a computer is knowledge which has been added by a human.,NONE,NONE,NONE,NONE
The computer does however have other qualities.,NONE,NONE,NONE,NONE
It's ability to communicate is another computer is exceptional.,exceptional,APPRECIATION,WORTH,POS
"Again this is due to the improvement in technology, instead of humans porting information or having a conversation on the telephone the computer is able to send an electronic message down the telephone line to a computer at the other end.",NONE,NONE,NONE,NONE
This computer then decodes the message and sends an appriate answer back.,NONE,NONE,NONE,NONE
Usually this is the piece of information asked for.,NONE,NONE,NONE,NONE
The computer has in a way replaced the human brain in that is now does the job a human brain used to do.,NONE,NONE,NONE,NONE
"The human brain has not become redundant due to the invention of the computer but instead man has found a way in which the life of a human can be made more efficient and less stressful, by the invention of the computer.", more efficient and less stressful,APPRECIATION,REACTION,POS
It is clear that in order for a computer to work it needs the input of a human brain and so in this respect it has definatley not replaced the human.,NONE,NONE,NONE,NONE
