sentence,highlight,category,subcategory,polarity
"Also weak government, especially within Britains 3 party system where the balance of power would always be held by the Liberal Democrats and the National Parties.",weak government,JUDGEMENT,CAPACITY,NEG
The main reason for feeling the luck of democrasy within the UK is through the creation of the one House democrasy.,the luck of democrasy,APPRECIATION,REACTION,POS
Throughout History there has been a gradual decline in the power and influence of the monarchy and the House of Lords.,NONE,NONE,NONE,NONE
This has meant the increased power of the House of Commons.,NONE,NONE,NONE,NONE
"Although many would argue that the power of the monarchy and the Lords, especially the hereditary ones, should be reduced within a modern democrasy they should be replaced by somthing to bring back the balance to the democrasy.",NONE,NONE,NONE,NONE
The three pronged system of British government was the envy of the world during the 18th century Enlightement.,was the envy of the world,APPRECIATION,REACTION,POS
"This erosion of the two other prongs, with the first past the post system has led to electoral dictatorships.",erosion has led to electoral dictatorships,APPRECIATION,REACTION,NEG
This was the case in the late 1980's with the Conservative government of Margaret Thatcher.,NONE,NONE,NONE,NONE
This her government was almost able to rule by decree due to the large size of her parliamentary majority.,almost able to rule by decree,JUDGEMENT,CAPACITY,POS
However it also meant its growing reputation from the true wishes of the people.,reputation from the true wishes,JUDGEMENT,VERACITY,POS
This is most clearly put into fucus by the Community Charge or Poll Tax fiasco.,most clearly put into fucus,JUDGEMENT,CAPACITY,POS
This policy was hugely unpopular among the people but the Government was able to push it through without opposition.,was able to push it through without opposition,JUDGEMENT,CAPACITY,POS
This alienation from the electorate led in part to Margaret Thatcher's downfall.,NONE,NONE,NONE,NONE
"What, then, are the options to make the British democrasy democratic again.",make the British democrasy democratic again,APPRECIATION,COMPOSITION,NEG
Many have advocated a to change to a proportioned representation system which would give equal numbers of seats to the share of the vote gained by each party.,NONE,NONE,NONE,NONE
"This is a view advocated by the Liberal Democatic Party who, despite polling about 20% of the vote at parliamentary elections only gain about 20 seats within the house of commons, that is about 3% of the total.",NONE,NONE,NONE,NONE
This system does have its pitfalls.,pitfalls,APPRECIATION,COMPOSITION,NEG
It can lead to weak and ineffecutual government as in Italy where governments seldom last over a year.,weak and ineffecutual,JUDGEMENT,CAPACITY,NEG
It can also allow the rise of the political extreems as in Italy also where even a small share of the entire vote (0.15%) would lead to a seat in Parliament.,NONE,NONE,NONE,NONE
The main way seen in getting round this problem is by adopting a single trans double vote system.,NONE,NONE,NONE,NONE
This would mean that after the first round of voting in a constituency the two candidates in with the most votes would then move on to a second ballot and so fight it out head to head.,NONE,NONE,NONE,NONE
This system has several advantages firstly the * candidate would claim a majority of the votes.,several advantages,APPRECIATION,COMPOSITION,POS
Also it would avoid the chance of minority parties gaining power over their * There would also be the added chance of a longer electoral campaign which would be popular with the Media.,popular,APPRECIATION,WORTH,POS
"This system seems fair, would not create too much change within the electoral system and themake up of the House of commons.",fair,JUDGEMENT,PROPRIETY,POS
The other main problem is that of rectifiyng the electoral dictatorships system.,problem,APPRECIATION,REACTION,NEG
There are several ways in which this could happen.,NONE,NONE,NONE,NONE
Firstly the removal of the monarchy.,NONE,NONE,NONE,NONE
This would then legitimise one of the 3 prongs of the system.,NONE,NONE,NONE,NONE
However only in America and France among first world democrasies does the president hold significant poise.,significant poise,APPRECIATION,WORTH,POS
So the replacement of one figure head with another seem *.,NONE,NONE,NONE,NONE
This would create no real change and remove the natural advantages the monarchy gives us.,remove the natural advantages,APPRECIATION,WORTH,NEG
The real reform should come with the second house.,NONE,NONE,NONE,NONE
The House of Lords traditionally moderates and ammends proposals put forward by the house of Commons.,NONE,NONE,NONE,NONE
This power has gradually been eroded to virtually nothing with the Lords only now possessing a temporary veto over legislation.,eroded to virtually nothing,APPRECIATION,WORTH,NEG
Many would say that the undemocratic make up of this house makes such changes fair.,fair,JUDGEMENT,PROPRIETY,POS
They may be fair but they also reduce the democrasy within Britain.,reduce the democrasy,JUDGEMENT,PROPRIETY,NEG
"An elected second house or senate would either give even more support to the government, thus ?ting the electoral dictatorship theory.",NONE,NONE,NONE,NONE
Or would create political deadlock with government legislation constantly being blocked and change.,deadlock,JUDGEMENT,CAPACITY,NEG
This may even lead to the political empass which is now occuring in America between Presidentant and Congress.,NONE,NONE,NONE,NONE
"The best system seems an apolitical second house which would contain people nominated from all walks of life such as industry, finance, law and order and Religion.",best,APPRECIATION,REACTION,POS
This house would then take a longer term political view over legislation and would be able to modify and change government policy.,would be able to modify,JUDGEMENT,CAPACITY,POS
This would change government from todays political short termism to long term benifits for the nation.,would change,APPRECIATION,WORTH,POS
"The present political system, as shown, is both antiquated, unfair and undemocratic.","antiquated, unfair and undemocratic",JUDGEMENT,PROPRIETY,NEG
It impossible within modern society to return to the democrasies of the ancient Greek city states.,impossible,JUDGEMENT,CAPACITY,NEG
However with modifications to voting systems and the nature of selection within the two houses of Parliament Britain could again have a democrasy which was the envy of the world.,could again have a democrasy which was the envy of the world,JUDGEMENT,CAPACITY,POS
The British parliamentary electoral system is unfair and undemocratic.,unfair and undemocratic,JUDGEMENT,PROPRIETY,NEG
"It is, however, in my opinion, the best way for the basis of government.",the best,APPRECIATION,REACTION,POS
"Consider a general election, in which three parties stand, X, Y, and Z, in a country of 5000 voters.",NONE,NONE,NONE,NONE
Supposing 2000 people vote for party X and 1500 vote for parties Y and Z.,NONE,NONE,NONE,NONE
Party X would come into power because they had the most votes.,NONE,NONE,NONE,NONE
"However there were 3000 people who did not want them to be in power, which is not the majority of the country.",NONE,NONE,NONE,NONE
"Also, the idea of each constituency having an MP who fights for that constituency's beliefs in parliament.",NONE,NONE,NONE,NONE
This has major flaws.,major flaws,APPRECIATION,COMPOSITION,NEG
"Consider, for example, the MP who recently decided she wanted to change parties.",NONE,NONE,NONE,NONE
"Yes, I know it is the MP's belief's the constituents are meant to vote on the ideas of that MP but this simply isn't the case in many circumstances, the voter votes on how that party for which that MP represents is doing at the moment.",NONE,NONE,NONE,NONE
"Once a party is in government it is free to do as it likes, changing it's policies, until the next general election, at which point it will make hollow promises about what it will do when it next gets in power, just to gain votes.",will make hollow promises,JUDGEMENT,VERACITY,NEG
"It is, as I said before, the best system.",the best system,APPRECIATION,REACTION,POS
"Consider dictatorships, this falls at the first hurdle.",NONE,NONE,NONE,NONE
"With this system any madman can control a country, having economic disasters for not only that country but other related countries.",madman / having economic disasters,JUDGEMENT,PROPRIETY,NEG
There is no fair and perfect way to run a country.,fair and perfect way,,,
"One please some people some of the time, but not all people all of the time.",NONE,NONE,NONE,NONE
"The only way a fair system of government can come about is in a group of about ten people at the most, and even then people are discontent.",fair system of government,JUDGEMENT,PROPRIETY,POS
The basic dilema facing the UK's rail and road transport system is the general rise in population.,NONE,NONE,NONE,NONE
"This leads to an increase in the number of commuters and transport users every year, consequently putting pressure on the UKs transports network.",NONE,NONE,NONE,NONE
The biggest worry to the system is the rapid rise of car users outside the major cities.,NONE,NONE,NONE,NONE
Most large cities have managed to incourage commuters to use public transport thus decreasing major conjestion in Rush hour periods.,have managed to incourage commuters,JUDGEMENT,CAPACITY,POS
"Public transport is the obvious solution to to the increase in population if it is made cheep to commuters, clean, easy and efficient then it could take the strain of the overloaded British roads.",obvious / cheap / clean / efficient,APPRECIATION,REACTION,POS
"For commuters who regularly travel long distances rail transport should be made more appealing, more comfortable and cheaper.",NONE,NONE,NONE,NONE
"Motorways and other transport links are constantly being extended, widened and slowly turning the country into a concrete jungle yet it is only trying to cope with the increase in traffic, we are our own enemy!",NONE,NONE,NONE,NONE
"Another major problem created by the mass of vehicle transport is the pollution emitted into the atmosphere damaging the ozone layer, creating smog and forming acid rain.",NONE,NONE,NONE,NONE
Tourturing the Earth we are living on.,Tourturing the Earth we are living on.,JUDGEMENT,PROPRIETY,NEG
"In concluding I wish to propose clean, efficient comfortable and cheap public transport for the near future.",efficient comfortable and cheap public transport,APPRECIATION,REACTION,POS
Traffic jams are becoming larger and more frequent.,NONE,NONE,NONE,NONE
Trains are never on time.,Trains are never on time.,JUDGEMENT,CAPACITY,NEG
Everybody always has a complaint about some part of the transport system in the United Kingdom.,NONE,NONE,NONE,NONE
"What is wrong, and what can we do about it?",NONE,NONE,NONE,NONE
"The amount of criticism aimed at the British rail network increases daily, and not without reason.",NONE,NONE,NONE,NONE
"Much of the rolling stock is old, slow, noisy and uncomfortable.","old, slow, noisy and uncomfortable",JUDGEMENT,CAPACITY,NEG
"Passengers whose life seems to revolve around annoying others - listening to not-quite-personal stereos, smoking in no smoking sections, putting bags on seat - are a common sight on trains.",Passengers whose life seems to revolve around annoying others,JUDGEMENT,PROPRIETY,NEG
"All this makes the train less appealling to the general public, and, in particular, the commuter.",NONE,NONE,NONE,NONE
"Another problem is that of understaffing, both on trains and at stations.",understaffing,JUDGEMENT,CAPACITY,NEG
"This leads to an increase in fare dodging, which is now quite possible unintentionally - with ticket offices closed at both ends of the journey, and no guard, who are you supposed to pay?",NONE,NONE,NONE,NONE
"All this leads to trains being unprofitable, except on a few major commuter routes.",NONE,NONE,NONE,NONE
"Many things have been tried to reverse this, but to no avail.",NONE,NONE,NONE,NONE
"Closing small lines which regularly lose money may seem sensible but leads to less people getting trains in general - after all if you have to drive twenty miles to the nearest station, you might as well just drive to wherever you are going.",NONE,NONE,NONE,NONE
"Increasing or decreasing prices could be tried, but as trains are more expensive than cars for most journeys anyway, this would have little effect.",NONE,NONE,NONE,NONE
"The only way to make profits is to get more people on trains, and this requires an improvement in services.",NONE,NONE,NONE,NONE
"This would initially cost a lot, and unfortunately sufficient funding is never available.",sufficient funding is never available,JUDGEMENT,CAPACITY,NEG
"As more and more people use cars, traffic in city centres during rush ours comes to a near standstill.",traffic in city centres during rush ours comes to a near standstill,JUDGEMENT,CAPACITY,NEG
"More cars arrive, get stuck in jams, and spread the congestion further and further out of the city, until motorways and bypasses become blocked.",NONE,NONE,NONE,NONE
The problem is obvious - there are too many cars on Britain's roads.,NONE,NONE,NONE,NONE
"There are two ways around the problem - reduce the number of cars, or build more roads.",NONE,NONE,NONE,NONE
"In cities, where all traffic jams start, there is no room for more roads - every square yard is already in use.",NONE,NONE,NONE,NONE
"The only place more roads can be built is outside cities, building more and wider motorways.",NONE,NONE,NONE,NONE
"This reduces the spread of traffic jams once they begin to stretch out of the city, but is environmentally damaging, both by destroying whatever happens to be on the route and, according to environmentalists, encouraging even more cars, and thus more pollution.",NONE,NONE,NONE,NONE
"So, the only way around the problem is to have less cars.",NONE,NONE,NONE,NONE
"There are three main ways of doing this: sharing cars, using public transport and walking or cycling.",NONE,NONE,NONE,NONE
"Sharing cars seems feasible, but is unpopular for various reasons.",NONE,NONE,NONE,NONE
It removes the element of independence afforded by a car - you have to decide exactly when and where you want to travel in advance.,NONE,NONE,NONE,NONE
"Also people who are paying for a car's road tax, insurance and depreciation prefer to use the car.",NONE,NONE,NONE,NONE
"Buses are almost without exception, old.",Buses are old,APPRECIATION,REACTION,NEG
"This makes them slow, and often uncomfortable.",slow / uncomfortable,APPRECIATION,REACTION,NEG
"The ""other passengers"" problem also occurs on buses, but you can't move to another carriage.",NONE,NONE,NONE,NONE
"To get from A to B, they stop at, and sometimes divert several miles to reach C, D and E. If you are going to be stuck in a traffic jam, people prefer to listen to their own choice of tape or radio station than thirty other people's conversations.",NONE,NONE,NONE,NONE
Trains have similar problems.,NONE,NONE,NONE,NONE
"They don't (usually) get stuck in traffic jams, but stations are often far from both home and work.",NONE,NONE,NONE,NONE
"People walking or using a bike are not protected from the elements and, until cars and buses are banned, have to breathe everybody else's exhaust fumes.",NONE,NONE,NONE,NONE
"These methods of transport are slow, and allow you to carry much less.",NONE,NONE,NONE,NONE
"If public transport was improved, more might use it, and ease the strain on roads.",NONE,NONE,NONE,NONE
"Unfortunately, the attitude of many drivers is, ""I think more people should use public transport, then, there'll be less cars on the road, so I can drive around more easily.""","the attitude of many drivers is, ""I think more people should use public transport.",JUDGEMENT,PROPRIETY,NEG
"Until this changes, there will be no improvement.",NONE,NONE,NONE,NONE
As transport has advanced over the past 200 years or so we have come to rely on it more and more.,NONE,NONE,NONE,NONE
"It has given us the freedom to travel anywhere within our own peninsular and, including our travel, almost anywhere in the world.",NONE,NONE,NONE,NONE
With the advent of the channel tunnel we can now travel throughout Europe as well.,NONE,NONE,NONE,NONE
"Travel has become and essential part of our everyday lives, we use it to go to work or school and just to get around in general because it's easier and quicker than walking.",NONE,NONE,NONE,NONE
The majority of our travelling is done by either road or rail.,NONE,NONE,NONE,NONE
"We use cars, buses and trains to go to work in.",NONE,NONE,NONE,NONE
"Transport is also very important for British industry lorries and trains are used to transport goods up and down the U.K.
Our need and dependance on road and rail transport has created supply.",NONE,NONE,NONE,NONE
The car industry is now one of the world's largest.,NONE,NONE,NONE,NONE
In the last 30 years we have seen the construction of a vast motorway network throughout the U.K. All of this has come at a price though.,NONE,NONE,NONE,NONE
It has reached the stage where we are totally dependant upon transport.,NONE,NONE,NONE,NONE
"Without it we could not get to work, fuels could not be transported to power stations to create our electricity and food could not be transported into our cities.",NONE,NONE,NONE,NONE
This huge use of transport causes damage to our natural environment.,damage to our natural environment,JUDGEMENT,PROPRIETY,NEG
The release of exhaust fumes from our vehicles such as C.F.C.s and CO our depleting the ozone layer which could have disastrous global consequences in years to come.,NONE,NONE,NONE,NONE
"During rush our traffic in most major cities throughout the U.K. a photochemical smog looms over the city, polluting the atmosphere.",NONE,NONE,NONE,NONE
There is strong evidence to suggest this causes asthma and other ailments I children.,NONE,NONE,NONE,NONE
Our roads have become congested.,NONE,NONE,NONE,NONE
For a minimum of two hours everyday the roads surrounding big cities are packed solid with people trying to get to and from work or school.,NONE,NONE,NONE,NONE
Train stations suffer the same problem.,NONE,NONE,NONE,NONE
We have tried to solve this problem by building wider roads and bypasses.,NONE,NONE,NONE,NONE
Some councils have tried to show a little more initiative by building bus lanes and trying to entice people to use public transport.,councils have tried to show a little more initiative,JUDGEMENT,CAPACITY,POS
These are mainly short term solutions that will eventually make the problem worse.,,,,
New roads will just bring new cars.,NONE,NONE,NONE,NONE
The problem is not inadequate road systems it's too much traffic.,inadequate,APPRECIATION,COMPOSITION,NEG
In order to solve our transport problems we need to start taking a more long term view.,long term view.,,,
"Cities such as Manchester have become largely pedestrianised and have seen the reintroduction of trams, this is the sort of scheme that can solve our problems.",NONE,NONE,NONE,NONE
If cars were banned from all city centres for 2 hours every morning and 2 hours every evening this would force people to use public transport.,NONE,NONE,NONE,NONE
Obviously an excellent public transport system would be required but may be then it would recieve the funding and customers it so desperately requires.,NONE,NONE,NONE,NONE
There are certain people such as police and social workers who have to travell around and visit people during the day.,NONE,NONE,NONE,NONE
These people could be granted special permits allowing them to use cars.,NONE,NONE,NONE,NONE
This would greatly reduce the traffic on our roads and help the rail and bus industry to thrive.,NONE,NONE,NONE,NONE
Many people may find they don't actually need a car at all.,NONE,NONE,NONE,NONE
Hopefully this would lead to a reversal of the damage we've done to the environment through reduced vehicle emissions.,damage we've done to the environment,JUDGEMENT,PROPRIETY,NEG
We should also encourage cycling as a mode of transport.,NONE,NONE,NONE,NONE
In Holland their is a complete network of cycle paths as well as roads.,NONE,NONE,NONE,NONE
It is possible to go by bike almost anywhere you can go by car.,NONE,NONE,NONE,NONE
This is a system that could be adopted in the U.K.,NONE,NONE,NONE,NONE
"It would relieve congestion on our roads, reduce pollution to the environment and help us become a fitter, healthier nation.",fitter / healthier,JUDGEMENT,CAPACITY,POS
The problems facing road transport are numerous with potentially severe penalties.,severe penalties,,,
"Today, the vast amount of UK families own a car.",NONE,NONE,NONE,NONE
"It is, no doubt, a fast way of commuting to and from destinations with little stress on the body, however traffic congestion is becoming a major concern in any city or town.",NONE,NONE,NONE,NONE
"It has even been attempted to build more roads for the cars to travel on, but it seems that the number of cars increases on the road increase, making the problem the same as it was before.",NONE,NONE,NONE,NONE
Lancaster is a very good example of a failed one way system.,failed one way system,JUDGEMENT,CAPACITY,NEG
It is becoming more apparent that walking is faster at peak times of the day (ie 08:00 and 17:00).,NONE,NONE,NONE,NONE
"Resulting from this failure, a bypass was introduced but is used by very few cars, amounting to another failure.",NONE,NONE,NONE,NONE
"Along with the traffic congestion, comes pollution.",NONE,NONE,NONE,NONE
The green house effect is a major issue to most citizens but very few of them are prepared to give up their car to show it.,NONE,NONE,NONE,NONE
"The government however, is beginning to address this issue and the car manufacturers are placing catalytic converters on their newer cars.",is beginning to address this issue,JUDGEMENT,CAPACITY,POS
"In areas such as Mexico City, the pollution is perfectly visible as a mass smog cloud can be seen enveloped over the city.",NONE,NONE,NONE,NONE
"These sites are also very common in the major American cities and even, at times, London.",NONE,NONE,NONE,NONE
With such are large no.,NONE,NONE,NONE,NONE
"of cars on the road, maintenance is another major issue.",NONE,NONE,NONE,NONE
£ billions are spent by the government alone trying to keep the UK roads in as best a condition as possible.,NONE,NONE,NONE,NONE
"Finally, the number of accidents is rapidly increasing, along with he number of cars.",NONE,NONE,NONE,NONE
One major factor of these accidents is road stress which can again be due to traffic congestion.,NONE,NONE,NONE,NONE
"All of these problems, one way or another, can all be linked with congestion and hence the number of cars on the road.",NONE,NONE,NONE,NONE
"To attempt to lessen this number, I have a number of solutions.",NONE,NONE,NONE,NONE
Park and Ride - have cars outside of town and catch a free/cheap bus into town.,NONE,NONE,NONE,NONE
"Improvent of public transport - Cheaper fares, cleaner, more pleasant environment to encourage them to leave their cars at home.",cheaper / cleaner/ more pleasant,APPRECIATION,REACTION,POS
In Italy a scheme was introduced so that odd number registration plates on cars could only go in on every alternate day of the week whilst even when on the other days.,NONE,NONE,NONE,NONE
"Cycle lanes/bus lanes - making it quicker to travel, especially through the congestive areas.",NONE,NONE,NONE,NONE
Rail transport is similar in ways such that their maintanence bills of track are becoming higher and higher as hooligans chuck things on them.,hooligans,JUDGEMENT,PROPRIETY,NEG
One major problem travelling by train in the UK through the peoples eyes are that they are very unreliable.,very unreliable,APPRECIATION,REACTION,NEG
Trains never get to theier destinations on time.,NONE,NONE,NONE,NONE
This view is very stereotypical but can be supported.,very stereotypical,JUDGEMENT,TENACITY,NEG
"Again at peak times, the trains can become very cramped with very few facilities and often dirty carriages.",very few facilities and often dirty,APPRECIATION,COMPOSITION,NEG
This isn't the fault of British rail but the last passenger on the train who dropped his litter.,the last passenger on the train who dropped his litter,JUDGEMENT,PROPRIETY,NEG
"British rail, now privatised, is under very fierce competition by cars and especially airplanes.",under very fierce competition,JUDGEMENT,CAPACITY,NEG
It seems to have been left behind by other countries like Japan who now have the bullet train or France with its TGV.,left behind,JUDGEMENT,CAPACITY,NEG
These are very fast and cost efficient ways that common and buisness men alike travel in luxury.,very fast and cost efficient,APPRECIATION,REACTION,POS
British rail need a bit of money to improve thier transportation methods by:,NONE,NONE,NONE,NONE
"Adding More carriages at peak times - less congestion
lowering fares",NONE,NONE,NONE,NONE
Improving facilities,NONE,NONE,NONE,NONE
"Reduce litter left in carriages, ie impose fines etc.",NONE,NONE,NONE,NONE
Improve speed/efficiency of trains,NONE,NONE,NONE,NONE
The number of cars in the United Kingdom has greatly increased since the mass motorway building schemes in the 1970's.,NONE,NONE,NONE,NONE
"This is putting increasing stress on our road network, especially along major commercial routes, such as Birmingham to London, and in town centres where the streets and roads were not designed for such a large number of cars.",increasing stress,APPRECIATION,REACTION,NEG
"This large no of cars is causing congestion and general ""wear and tear"" of our roads.","""wear and tear""",APPRECIATION,REACTION,NEG
"The easy access to cars has enabled people to move out of the polluted, ""grey"" cities and into out-of-town villages where they can commute."," ""grey"" cities",APPRECIATION,REACTION,NEG
